{
  "$hsa_kind": "strategy_package",
  "$hsa_contract_version": "1.0.0",
  "strategy_id": "gold_context_breakout",
  "strategy_version": "1.0.0",
  "title": "Gold 4H context with 5M breakout trigger",
  "description": "A governed package composing a 4H golden-cross context with a 5M range-breakout trigger.",
  "thesis": "Breakouts taken in the direction of an established higher-timeframe trend regime resolve more often than breakouts taken against it.",
  "instruments": [
    "XAUUSD"
  ],
  "intended_horizon": "INTRADAY",
  "intended_style": "Trend-aligned intraday breakout, one setup per context episode.",
  "required_hermes_fields": [
    {
      "field": "ma.fast",
      "purpose": "Fast simple moving average of close.",
      "timeframe": "4H"
    },
    {
      "field": "ma.slow",
      "purpose": "Slow simple moving average of close.",
      "timeframe": "4H"
    },
    {
      "field": "range.high",
      "purpose": "High of the preceding consolidation range.",
      "timeframe": "5M"
    },
    {
      "field": "range.low",
      "purpose": "Low of the preceding consolidation range.",
      "timeframe": "5M"
    },
    {
      "field": "candle.close",
      "purpose": "Close of the evaluated bar.",
      "timeframe": "5M"
    }
  ],
  "atomic_strategies": [
    {
      "$hsa_kind": "atomic_strategy",
      "$hsa_contract_version": "1.0.0",
      "strategy_id": "golden_cross",
      "strategy_version": "1.0.0",
      "title": "Golden cross",
      "description": "Fast moving average crosses above the slow moving average on the evaluated timeframe.",
      "thesis": "A sustained shift of the short-horizon mean above the long-horizon mean marks a regime in which continuation is more likely than mean reversion.",
      "instruments": [
        "XAUUSD"
      ],
      "required_hermes_fields": [
        {
          "field": "ma.fast",
          "purpose": "Fast simple moving average of close.",
          "timeframe": "4H"
        },
        {
          "field": "ma.slow",
          "purpose": "Slow simple moving average of close.",
          "timeframe": "4H"
        }
      ],
      "parameters": [
        {
          "name": "fast_period",
          "description": "Lookback of the fast moving average, in bars of the evaluated timeframe.",
          "type": "integer",
          "default": 50,
          "units": "bars",
          "allowed_range": {
            "minimum": 5,
            "maximum": 200,
            "step": 1
          }
        },
        {
          "name": "slow_period",
          "description": "Lookback of the slow moving average, in bars of the evaluated timeframe.",
          "type": "integer",
          "default": 200,
          "units": "bars",
          "allowed_range": {
            "minimum": 20,
            "maximum": 400,
            "step": 1
          }
        }
      ],
      "direction_semantics": {
        "emits": [
          "LONG",
          "SHORT"
        ],
        "direction_rule": "LONG when fast crosses above slow; SHORT when fast crosses below slow.",
        "inversion_allowed": false
      },
      "output_contract": {
        "signal_type": "BOOLEAN",
        "fields": [
          {
            "name": "matched",
            "type": "boolean",
            "description": "True on the bar the cross completes."
          },
          {
            "name": "direction",
            "type": "string",
            "description": "LONG or SHORT."
          },
          {
            "name": "reason",
            "type": "string",
            "description": "Why the bar did or did not match."
          }
        ],
        "reason_field": "reason",
        "emits_on_insufficient_history": "NULL"
      },
      "deterministic_test_cases": [
        {
          "case_id": "cross_up_matches",
          "description": "Fast crosses from below to above slow on the evaluated bar.",
          "given_hermes_facts": {
            "ma.fast": [
              1990.0,
              2005.0
            ],
            "ma.slow": [
              2000.0,
              2000.5
            ]
          },
          "given_parameters": {
            "fast_period": 50,
            "slow_period": 200
          },
          "expected_output": {
            "matched": true,
            "direction": "LONG"
          }
        },
        {
          "case_id": "no_cross_does_not_match",
          "description": "Fast stays below slow across both bars.",
          "given_hermes_facts": {
            "ma.fast": [
              1990.0,
              1995.0
            ],
            "ma.slow": [
              2000.0,
              2000.5
            ]
          },
          "given_parameters": {
            "fast_period": 50,
            "slow_period": 200
          },
          "expected_output": {
            "matched": false
          }
        }
      ],
      "provenance": {
        "source_type": "MATT_OBSERVATION",
        "source_reference": "HSA v1 contract fixture — canonical atomic example named at PID line 55.",
        "ingested_at_utc": "2026-09-04T00:00:00Z"
      },
      "doctrine_assertions": {
        "self_contained": true,
        "independently_testable": true,
        "deterministic": true,
        "execution_blind": true,
        "unaware_of_other_strategies": true,
        "hermes_driven": true
      }
    },
    {
      "$hsa_kind": "atomic_strategy",
      "$hsa_contract_version": "1.0.0",
      "strategy_id": "range_breakout",
      "strategy_version": "1.0.0",
      "title": "Range breakout",
      "description": "Close breaks beyond the high or low of the preceding consolidation range by a bounded margin.",
      "thesis": "A decisive close outside a compressed range signals that accumulated order flow has resolved in one direction.",
      "instruments": [
        "XAUUSD"
      ],
      "required_hermes_fields": [
        {
          "field": "range.high",
          "purpose": "High of the preceding consolidation range.",
          "timeframe": "5M"
        },
        {
          "field": "range.low",
          "purpose": "Low of the preceding consolidation range.",
          "timeframe": "5M"
        },
        {
          "field": "candle.close",
          "purpose": "Close of the evaluated bar.",
          "timeframe": "5M"
        }
      ],
      "parameters": [
        {
          "name": "range_lookback",
          "description": "Number of bars used to define the consolidation range.",
          "type": "integer",
          "default": 12,
          "units": "bars",
          "allowed_range": {
            "minimum": 3,
            "maximum": 96,
            "step": 1
          }
        },
        {
          "name": "break_margin_ratio",
          "description": "Minimum break beyond the range boundary, as a fraction of the range height. Replaces the discretionary phrase good breakout with a measurable threshold.",
          "type": "number",
          "default": 0.1,
          "units": "ratio",
          "allowed_range": {
            "minimum": 0.0,
            "maximum": 1.0
          }
        }
      ],
      "direction_semantics": {
        "emits": [
          "LONG",
          "SHORT"
        ],
        "direction_rule": "LONG on a break above range.high; SHORT on a break below range.low.",
        "inversion_allowed": false
      },
      "output_contract": {
        "signal_type": "BOOLEAN",
        "fields": [
          {
            "name": "matched",
            "type": "boolean",
            "description": "True when the close breaks the range by at least the margin."
          },
          {
            "name": "direction",
            "type": "string",
            "description": "LONG or SHORT."
          },
          {
            "name": "reason",
            "type": "string",
            "description": "Why the bar did or did not match."
          }
        ],
        "reason_field": "reason",
        "emits_on_insufficient_history": "NULL"
      },
      "deterministic_test_cases": [
        {
          "case_id": "break_above_matches",
          "description": "Close exceeds range.high by more than the margin.",
          "given_hermes_facts": {
            "range.high": 2010.0,
            "range.low": 2000.0,
            "candle.close": 2012.0
          },
          "given_parameters": {
            "range_lookback": 12,
            "break_margin_ratio": 0.1
          },
          "expected_output": {
            "matched": true,
            "direction": "LONG"
          }
        },
        {
          "case_id": "marginal_break_does_not_match",
          "description": "Close exceeds range.high by less than the margin.",
          "given_hermes_facts": {
            "range.high": 2010.0,
            "range.low": 2000.0,
            "candle.close": 2010.5
          },
          "given_parameters": {
            "range_lookback": 12,
            "break_margin_ratio": 0.1
          },
          "expected_output": {
            "matched": false
          }
        }
      ],
      "provenance": {
        "source_type": "MATT_OBSERVATION",
        "source_reference": "HSA v1 contract fixture — canonical atomic example named at PID line 55.",
        "ingested_at_utc": "2026-09-04T00:00:00Z"
      },
      "doctrine_assertions": {
        "self_contained": true,
        "independently_testable": true,
        "deterministic": true,
        "execution_blind": true,
        "unaware_of_other_strategies": true,
        "hermes_driven": true
      }
    }
  ],
  "timeframe_roles": {
    "CONTEXT": "4H",
    "TRIGGER": "5M"
  },
  "chain": {
    "$hsa_kind": "chain",
    "$hsa_contract_version": "1.0.0",
    "chain_id": "gold_context_breakout",
    "chain_version": "1.0.0",
    "title": "Higher-timeframe context with lower-timeframe breakout trigger",
    "description": "A 4H golden cross must hold as context while a 5M range breakout fires as trigger.",
    "instruments": [
      "XAUUSD"
    ],
    "primitive": "CONTEXT_TRIGGER",